{
  "schemaVersion": 1,
  "policyVersion": "model-route-v1",
  "mappingVersion": "openai-codex-model-route-map-v1",
  "featureHash": "aaaaaaaaaaaaaaaaaaaaaaaaaaaaaaaaaaaaaaaaaaaaaaaaaaaaaaaaaaaaaaaa",
  "mode": "recommend",
  "objective": "balance",
  "capabilityBand": "low",
  "safetyFloor": "low",
  "fallbackBand": null,
  "provider": "openai-codex",
  "modelId": "gpt-5.6-luna",
  "effort": "medium",
  "currentProvider": "openai-codex",
  "currentModelId": "gpt-5.6-sol",
  "currentEffort": "high",
  "selectionSource": "global-default",
  "confidence": "high",
  "disposition": "recommended",
  "reasonCodes": ["bounded-explicit-task", "cheap-verifier-ready", "safety-floor-low", "objective-balance", "candidate-low", "runtime-catalog-match"],
  "downgradeSteps": 2,
  "catalogDigest": "bbbbbbbbbbbbbbbbbbbbbbbbbbbbbbbbbbbbbbbbbbbbbbbbbbbbbbbbbbbbbbbb",
  "decisionDigest": "59be04ee09c06329e883a82777bf75d20c9227c26683ab16a575da43d22055ab",
  "enforced": false
}
